{
  "verdict": "escalate",
  "risk_flags": [
    {
      "type": "repeated_failure",
      "severity": "P2",
      "reason": "The owner-scope failure is now the same root cause for the second consecutive turn. Turn 1 failed with 'expected 404 got 200 for non-owner PATCH'; turn 2 added an explicit getDocumentById/user_id owner check yet the same spec still fails with the non-owner PATCH (uploaded-document variant) returning 200 instead of 404 (evidence/vitest-turn-2.txt:9-10). STATE mandates the chunk fails closed if the same root cause repeats. Acceptance criteria 1 and 2 are unmet; needs human/replan rather than a third blind attempt.",
      "required_route": "async_card"
    },
    {
      "type": "low_confidence",
      "severity": "P3",
      "reason": "Root cause cannot be diagnosed from the pack: lib/db/queries.js (getDocumentById/updateNote) and tests/notes-crud.test.js are not included, so I cannot confirm why the owner check fails to catch the uploaded-document source_type variant. The fix targets a symptom without visibility into the query layer it depends on.",
      "required_route": "async_card"
    }
  ],
  "failure_classification": {
    "same_root_cause": true,
    "matches_failure_id": "turn-1",
    "evidence": "Turn-1 failure: vitest notes-crud › owner scope, 'expected 404 got 200 for non-owner PATCH'. Turn-2 failure (evidence/vitest-turn-2.txt:9-10): same spec 'notes-crud › owner scope', non-owner PATCH against an uploaded document of another user returns 200 instead of 404. Same test, same assertion family, same root cause (owner-scope 404 not enforced for non-owners) across both turns."
  },
  "register_updates": [
    {
      "action": "create",
      "id": "RISK-0202",
      "type": "repeated_failure",
      "severity": "P2",
      "status": "open",
      "introduced_by": "critic"
    }
  ],
  "next_executor_prompt": null,
  "state_patch_proposal": {
    "current_chunk": "NOTES-CRUD-HARDENING, turn 2",
    "objective": "fix the owner-scope test failure; chunk fails closed because the same root cause repeated across turns 1 and 2",
    "open_risk_ids": [
      "RISK-0201",
      "RISK-0202"
    ],
    "decisions_refs": [
      "DEC-N40"
    ],
    "next_action": "Halt automated attempts. Human review required: the owner-scope 404 enforcement has failed twice on the same root cause. Provide lib/db/queries.js (getDocumentById/updateNote) and tests/notes-crud.test.js so the source_type/ownership query path can be diagnosed before a third attempt."
  },
  "evidence": [
    {
      "claim": "owner-scope spec still fails in turn 2; non-owner PATCH of an uploaded document returns 200 not 404",
      "type": "test_output",
      "path": "evidence/vitest-turn-2.txt",
      "line_range": "9-10"
    },
    {
      "claim": "turn-2 fix adds getDocumentById + doc.user_id !== userId owner check before updateNote, yet test still fails",
      "type": "diff",
      "path": "diff.patch",
      "line_range": "20-29"
    },
    {
      "claim": "post-change route file confirms the owner check and scoped updateNote(id, userId, ...) call",
      "type": "file",
      "path": "files/app/api/notes/[id]/route.js",
      "line_range": "15-24"
    },
    {
      "claim": "turn-1 failure was the same owner-scope spec returning 200 instead of 404 for a non-owner PATCH",
      "type": "report",
      "path": "executor_report.json",
      "line_range": "1-30"
    },
    {
      "claim": "scanner flagged auth import (P1A) and a write-verb on a comment line (P1B); both occur inside green-tier app/api/notes new file within approved DEC-N40 hardening scope, the write-verb hit is on the comment line not executable code",
      "type": "report",
      "path": "scanner_report.json",
      "line_range": "7-23"
    },
    {
      "claim": "RISK-0201 remains open (P3 low_confidence) and is not resolved by this turn",
      "type": "register",
      "path": "scanner_report.json",
      "line_range": "1-1"
    }
  ],
  "confidence": "high"
}