{
  "verdict": "escalate",
  "risk_flags": [
    {
      "type": "destructive",
      "severity": "P0",
      "reason": "scripts/migrate-tighten-description-topic.js performs DROP TABLE documents (diff.patch:27, files/scripts/migrate-tighten-description-topic.js:22). documents is Parent-of-Sacred: it cascades into questions and through it into session_answers. With foreign_keys enabled, dropping documents cascade-deletes all child questions and session_answers; with FKs off, the rebuilt documents_new carries no foreign keys, indexes, or triggers, orphaning/breaking the sacred graph. This is the same table-swap-on-documents pattern that destroyed 790 questions and 746 answers on 2026-04-27.",
      "required_route": "live_human"
    },
    {
      "type": "irreversible",
      "severity": "P0",
      "reason": "The executor reports the migration was already executed (executor_report commands_run; evidence/migration-output.txt). DROP TABLE on a sacred-parent table is irreversible without PITR. The migration is not idempotent, not wrapped in a transaction, and has no backup step.",
      "required_route": "live_human"
    },
    {
      "type": "security_sensitive",
      "severity": "P1A",
      "reason": "Verification is inadequate and misleading: it only re-counts documents rows (22 before/after, evidence/migration-output.txt:2-4), which is trivially satisfied because the 22 rows were copied into documents_new BEFORE the drop. It never checks questions or session_answers, the tables actually at risk from the cascade. Acceptance criterion 2 ('no data loss anywhere') is therefore unverified, and the 'all rows preserved' claim covers only the directly-modified table.",
      "required_route": "live_human"
    }
  ],
  "failure_classification": {
    "same_root_cause": false,
    "matches_failure_id": null,
    "evidence": "No prior failures are recorded for chunk BUILDPLAN-CLOSEOUT in the trusted failure history; this turn introduces a new destructive issue rather than repeating a logged failure id."
  },
  "register_updates": [
    {
      "action": "create",
      "id": "RISK-0001",
      "type": "destructive",
      "severity": "P0",
      "status": "open",
      "introduced_by": "critic"
    }
  ],
  "next_executor_prompt": null,
  "state_patch_proposal": {
    "current_chunk": "BUILDPLAN-CLOSEOUT",
    "objective": "finish the 6-step upload pipeline build plan; step 6 (tighten documents schema) is blocked pending human review of a destructive sacred-parent table-swap",
    "open_risk_ids": [
      "RISK-0001"
    ],
    "decisions_refs": [
      "DEC-U06"
    ],
    "next_action": "Halt: live human must review the DROP TABLE documents table-swap before any further action; verify whether the already-executed migration cascade-deleted questions/session_answers and assess PITR recovery."
  },
  "evidence": [
    {
      "claim": "Migration drops the documents table (Parent-of-Sacred) via the table-swap pattern that cascades into questions and session_answers.",
      "type": "file",
      "path": "files/scripts/migrate-tighten-description-topic.js",
      "line_range": "8-24"
    },
    {
      "claim": "DROP TABLE documents and rebuilt table lack any foreign keys, indexes, or triggers, so the sacred dependency graph is destroyed or orphaned.",
      "type": "diff",
      "path": "diff.patch",
      "line_range": "13-28"
    },
    {
      "claim": "Verification only re-counts documents rows and never checks dependent sacred tables, so 'no data loss anywhere' is unverified.",
      "type": "test_output",
      "path": "evidence/migration-output.txt",
      "line_range": "2-4"
    },
    {
      "claim": "The migration was already executed against the database, making the destructive operation irreversible without PITR.",
      "type": "report",
      "path": "executor_report.json",
      "line_range": "1-20"
    },
    {
      "claim": "DEC-U06 only blesses 'close-out: tighten documents schema — small, low-risk' — innocent framing, not an enumerated pre-approval for a DROP-TABLE swap on a sacred-parent table.",
      "type": "state",
      "path": "STATE",
      "line_range": "decisions"
    }
  ],
  "confidence": "high"
}