{
  "verdict": "done",
  "risk_flags": [
    {
      "type": "destructive",
      "severity": "P1C",
      "reason": "Route writes to sacred table `questions`: a retire UPDATE (retired_at/retired_reason/is_retired) and an INSERT of replacement rows. Both fall inside the enumerated DEC-V5-12 pre-approval. Verified in-bounds: the UPDATE matches the exact pre-approved predicate `WHERE block_id = ? AND user_id = ? AND retired_at IS NULL` and runs inside the generate transaction (files/.../route.js:52-59); the INSERT is owner-scoped (user_id = userId, files/.../route.js:62-67); no DELETE on questions exists anywhere in the route; no other sacred-table statement (session_answers untouched). Logged per P1C, not escalated.",
      "required_route": "logged_only"
    }
  ],
  "failure_classification": {
    "same_root_cause": false,
    "matches_failure_id": null,
    "evidence": "No failures this turn (executor failures=[], 18/18 verification checks pass at evidence/verification-suite-output.txt:34) and no prior failures recorded for chunk NOTESV5-3."
  },
  "register_updates": [
    {
      "action": "create",
      "id": "RISK-0202",
      "type": "destructive",
      "severity": "P1C",
      "status": "accepted",
      "introduced_by": "critic",
      "resolution_evidence": [
        "questions UPDATE/INSERT match DEC-V5-12 enumerated pre-approval scope exactly; UPDATE predicate and transaction placement verified at files/app/api/notes/[id]/generate/route.js:52-59",
        "INSERT owner-scoped at files/app/api/notes/[id]/generate/route.js:62-67; no DELETE on questions in route",
        "verification suite confirms 0 questions deleted, retire scoping, cross-user isolation, SR continuity at evidence/verification-suite-output.txt:11-21"
      ]
    }
  ],
  "next_executor_prompt": null,
  "state_patch_proposal": {
    "current_chunk": "NOTESV5-4",
    "objective": "v5 canvas UI on top of the completed block-model generate route (retire-not-delete contract landed)",
    "open_risk_ids": [
      "RISK-0201"
    ],
    "decisions_refs": [
      "DEC-V5-10",
      "DEC-V5-12",
      "DEC-V5-13"
    ],
    "next_action": "Begin v5 canvas UI (Chunk 4); NOTESV5-3 generate route + verification suite complete"
  },
  "evidence": [
    {
      "claim": "Selects up to 5 oldest stale blocks ordered stale_since asc, sealed_at asc, id asc (criterion 1)",
      "type": "file",
      "path": "files/app/api/notes/[id]/generate/route.js",
      "line_range": "19-27"
    },
    {
      "claim": "AI calls run outside any DB transaction; hard failure returns 502 before the transaction opens (criterion 2)",
      "type": "file",
      "path": "files/app/api/notes/[id]/generate/route.js",
      "line_range": "35-47"
    },
    {
      "claim": "Retire-not-delete: questions UPDATE sets retired_at/retired_reason='block_regenerated'/is_retired=1, scoped to block_id + user_id + retired_at IS NULL (criterion 3)",
      "type": "file",
      "path": "files/app/api/notes/[id]/generate/route.js",
      "line_range": "52-59"
    },
    {
      "claim": "All DB writes inside one db.transaction('write'); version-checked note_blocks bump checks rowsAffected and rolls the whole transaction back with a 409 on miss (criterion 4)",
      "type": "file",
      "path": "files/app/api/notes/[id]/generate/route.js",
      "line_range": "47-87"
    },
    {
      "claim": "No DELETE statement in the route and session_answers never referenced — SR continuity by construction (criterion 5)",
      "type": "file",
      "path": "files/app/api/notes/[id]/generate/route.js",
      "line_range": "1-93"
    },
    {
      "claim": "Verification suite (evidence of record) passes 18/18: 0 questions deleted, retire scoping, cross-user isolation, session_answers 2→2, forced-conflict full rollback, 502 path zero writes (criterion 6)",
      "type": "test_output",
      "path": "evidence/verification-suite-output.txt",
      "line_range": "7-34"
    },
    {
      "claim": "Sacred-table writes flagged P0/P1A by scanner correspond exactly to the DEC-V5-12 pre-approved UPDATE/INSERT; auth import is standard Clerk usage in a green-tier route, not a middleware change",
      "type": "report",
      "path": "scanner_report.json",
      "line_range": "8-103"
    },
    {
      "claim": "Only the green-tier generate route changed; no migration, dependency, or middleware/package.json change",
      "type": "diff",
      "path": "diff.patch",
      "line_range": "1-99"
    },
    {
      "claim": "Register holds only RISK-0201 (P3 open, unrelated to this chunk); no open P0/P1 blocking done",
      "type": "register",
      "path": "scanner_report.json",
      "line_range": "1-1"
    }
  ],
  "confidence": "high"
}