{
  "verdict": "continue",
  "risk_flags": [
    {
      "type": "security_sensitive",
      "severity": "P1C",
      "reason": "Route writes to the sacred `questions` table: an UPDATE (retire path) and an INSERT (replacement rows). Both fall inside the enumerated DEC-V5-12 pre-approval. The UPDATE scope (SET retired_at/retired_reason/is_retired WHERE block_id = ? AND user_id = ? AND retired_at IS NULL, inside the transaction) matches the approved exact_scope verbatim; the INSERT is owner-scoped (user_id = userId). No DELETE statement exists on questions or any sacred table. Within scope — logged, not a stop.",
      "required_route": "logged_only"
    }
  ],
  "failure_classification": {
    "same_root_cause": false,
    "matches_failure_id": null,
    "evidence": "No prior failures recorded for this chunk and no failure this turn; verification-suite-output.txt reports 18/18 checks pass."
  },
  "register_updates": [],
  "next_executor_prompt": "Work is on track and the sacred-write path stays inside the DEC-V5-12 scope; the verification suite passes. One acceptance-criteria gap remains under criterion 4: a version-conflict rolls back and returns 409, but the body carries only `{ error, block_id }` — not the block's *current state*. Enrich the 409 payload so the client can re-sync without a second round-trip (e.g. include the current block version / stale_since for the conflicting block, read inside the same transaction before rollback or via a follow-up read), and add or extend a verification-suite check asserting the 409 body carries that current state. Re-run `node scripts/verify-notes-v5-chunk3.js` and attach the output. Change nothing else; do not add any DELETE on questions or any other sacred-table statement.",
  "state_patch_proposal": null,
  "evidence": [
    {
      "claim": "Retire UPDATE on sacred `questions` matches the DEC-V5-12 enumerated scope exactly: SET retired_at/retired_reason='block_regenerated'/is_retired=1 WHERE block_id = ? AND user_id = ? AND retired_at IS NULL, inside the write transaction; args are [block.id, userId].",
      "type": "file",
      "path": "files/app/api/notes/[id]/generate/route.js",
      "line_range": "52-59"
    },
    {
      "claim": "Replacement INSERT into `questions` is owner-scoped (user_id = userId) per the second DEC-V5-12 pre-approval.",
      "type": "file",
      "path": "files/app/api/notes/[id]/generate/route.js",
      "line_range": "61-68"
    },
    {
      "claim": "No DELETE statement on questions or any sacred table exists anywhere in the route; only SELECT, UPDATE, INSERT, and a non-sacred note_blocks UPDATE.",
      "type": "file",
      "path": "files/app/api/notes/[id]/generate/route.js",
      "line_range": "1-93"
    },
    {
      "claim": "AI calls run outside the DB transaction; a hard failure is caught and returns 502 before any tx is opened, so zero DB writes on hard AI failure (criterion 2).",
      "type": "file",
      "path": "files/app/api/notes/[id]/generate/route.js",
      "line_range": "35-47"
    },
    {
      "claim": "All DB writes execute inside one db.transaction('write'); the conditional version-bump checks rowsAffected !== 1 and rolls the whole transaction back with a 409 (criterion 4 atomicity).",
      "type": "file",
      "path": "files/app/api/notes/[id]/generate/route.js",
      "line_range": "47-87"
    },
    {
      "claim": "Acceptance-criterion-4 gap: the 409 conflict response carries only block_id, not the block's current state.",
      "type": "file",
      "path": "files/app/api/notes/[id]/generate/route.js",
      "line_range": "78-81"
    },
    {
      "claim": "Verification suite is evidenced and passes 18/18, including retire-vs-delete invariants (0 deleted), cross-user scoping, full rollback on forced version conflict, AI-failure 502 with unchanged counts, session_answers 2→2 untouched, and blast-radius counts.",
      "type": "test_output",
      "path": "evidence/verification-suite-output.txt",
      "line_range": "1-34"
    }
  ],
  "confidence": "high"
}