{
  "verdict": "escalate",
  "risk_flags": [
    {
      "type": "security_sensitive",
      "severity": "P1B",
      "reason": "The executor ran enable-notes-cohort.js (Clerk publicMetadata.hasNotesAccess=true for 3 cohort users), externally exposing the Notes experiment, BEFORE the containment precondition was satisfied. Acceptance criterion 1 requires flag-aware containment verified on every user-facing surface explicitly including the Progress page; criterion 3 permits enabling 'only after 1-2 are evidenced.' This is a permissions/auth grant to production users gated on an unmet hard precondition.",
      "required_route": "live_human"
    },
    {
      "type": "scope_drift",
      "severity": "P1B",
      "reason": "Containment audit covers study queue, stats helpers, library, and navigation only — the Progress page surface required by acceptance criterion 1 is entirely absent from the evidence (audit line 26 enumerates only four surfaces). With the Progress surface unverified, criteria 1 and 2 are not met, yet the flag was already enabled, exposing the experiment with an unverified containment surface.",
      "required_route": "live_human"
    }
  ],
  "failure_classification": {
    "same_root_cause": false,
    "matches_failure_id": null,
    "evidence": "No prior failures recorded for this chunk; this is the first turn, so there is no prior root cause to match."
  },
  "register_updates": [
    {
      "action": "create",
      "id": "RISK-0202",
      "type": "security_sensitive",
      "severity": "P1B",
      "status": "open",
      "introduced_by": "critic",
      "resolution_evidence": []
    }
  ],
  "next_executor_prompt": null,
  "state_patch_proposal": {
    "current_chunk": "NOTES-7",
    "objective": "first external exposure of the Notes experiment; containment-first rollout discipline applies (no notes-derived data may reach non-flagged or revoked users)",
    "open_risk_ids": [
      "RISK-0201",
      "RISK-0202"
    ],
    "decisions_refs": [
      "DEC-N20",
      "DEC-N30"
    ],
    "next_action": "Human review required: cohort flag was enabled before containment was verified on the Progress page surface; decide on rollback/containment before continuing"
  },
  "evidence": [
    {
      "claim": "Containment audit enumerates only four surfaces (study queue, stats helpers, library, navigation) and omits the Progress page required by acceptance criterion 1.",
      "type": "test_output",
      "path": "evidence/containment-audit.txt",
      "line_range": "5-27"
    },
    {
      "claim": "The executor created and ran a script that writes hasNotesAccess=true to Clerk publicMetadata for the cohort, externally enabling the experiment.",
      "type": "diff",
      "path": "diff.patch",
      "line_range": "19-30"
    },
    {
      "claim": "Scanner flagged the Clerk auth content and permissions write at P1A / live_human, confirming an auth-adjacent permissions change.",
      "type": "report",
      "path": "scanner_report.json",
      "line_range": "32-47"
    }
  ],
  "confidence": "high"
}